#CODE;ENGLISH;FRENCH;GERMAN;;SPANISH;;;;;;;;;x
EVTOPTANOMADA.629;If the Council deems it wise, then that is what we shall do.;;;;;;;;;;;;x
EVTOPTANOMADB.629;We will continue on.;;;;;;;;;;;;x
NOMADEVTDESC630A;In the most recent meeting of the Elder Council of Air Nomads, and the majority of Elders have decided to further promote and enshrine our sacred traditions of pacifism, countering any alternative schools of thought that might be spreading through the Air Temples.;;;;;;;;;;;;x
NOMADEVTDESC630B;In the most recent meeting of the Elder Council of Air Nomads, and the majority of Elders have decided against further promoting of the sacred traditions of pacifism, feeling we Air Nomads honour those ideas already enough.;;;;;;;;;;;;x
EVTOPTANOMADA.630;The Council chooses tradition.;;;;;;;;;;;;x
EVTOPTANOMADB.630;The Council thinks things fine as they are.;;;;;;;;;;;;x
NOMADEVTDESC631A;In the most recent meeting of the Elder Council of Air Nomads, and the majority of Elders have decided to embrace and promote alternative schools of thought, in the name of freedom, introducing ideas different than our more traditional ideal of pacifism.;;;;;;;;;;;;x
NOMADEVTDESC631B;In the most recent meeting of the Elder Council of Air Nomads, and the majority of Elders have decided against the idea of promoting alternative schools of thought than our more traditional, Pacifistic views, feeling we must stay true to them.;;;;;;;;;;;;x
EVTOPTANOMADA.631;The Council seems to peruse alternative views.;;;;;;;;;;;;x
EVTOPTANOMADB.631;Things will stay as they are.;;;;;;;;;;;;x
NOMADEVTDESC632A;In the most recent meeting of the Elder Council of Air Nomads, and the majority of Elders have decided to promote and encourage trade between the Air Temples and outsider merchant and traders. This will hopefully bring many benefits to us, especially our coffers.;;;;;;;;;;;;x
NOMADEVTDESC632B;In the most recent meeting of the Elder Council of Air Nomads, and the majority of Elders have decided against the idea of further promoting trade between the Air Temples and the outside world, feeling it opens us to too great a many risks.;;;;;;;;;;;;x
EVTOPTANOMADA.632;The coffers will benefit from this decision.;;;;;;;;;;;;x
EVTOPTANOMADB.632;The Council perhaps see no need for it.;;;;;;;;;;;;x
NOMADEVTDESC633A;In the most recent meeting of the Elder Council of Air Nomads, and the majority of Elders have decided to take action against trade between the Air Temples and outsiders, saying it brings too many ills into our peaceful communities. Hence forth, such trade will be discouraged.;;;;;;;;;;;;x
NOMADEVTDESC633B;In the most recent meeting of the Elder Council of Air Nomads, and the majority of Elders have decided against taking action against outsider trade, feeling the current arrangement is ideal enough.;;;;;;;;;;;;x
EVTOPTANOMADA.633;We never needed trade with outsiders.;;;;;;;;;;;;x
EVTOPTANOMADB.633;At least this won't hurt our coffers...;;;;;;;;;;;;x